{
  "id": "asset-types",
  "createdAt": "2026-02-03T00:00:00.000Z",
  "updatedAt": "2026-02-03T00:00:00.000Z",
  "assetTypes": [
    {
      "id": "ui_icon",
      "label": "UI Icon",
      "requiresAlpha": true,
      "multiFrame": false,
      "defaultTags": ["assetType:ui_icon"]
    },
    {
      "id": "logo",
      "label": "Logo",
      "requiresAlpha": true,
      "multiFrame": false,
      "defaultTags": ["assetType:logo"]
    },
    {
      "id": "sprite",
      "label": "Sprite",
      "requiresAlpha": true,
      "multiFrame": false,
      "defaultTags": ["assetType:sprite"]
    },
    {
      "id": "spritesheet",
      "label": "Spritesheet",
      "requiresAlpha": true,
      "multiFrame": true,
      "defaultTags": ["assetType:spritesheet"]
    },
    {
      "id": "texture",
      "label": "Texture",
      "tileable": true,
      "multiFrame": false,
      "defaultTags": ["assetType:texture"]
    },
    {
      "id": "tile",
      "label": "Tile",
      "tileable": true,
      "multiFrame": false,
      "defaultTags": ["assetType:tile"]
    },
    {
      "id": "overlay",
      "label": "Overlay/VFX",
      "requiresAlpha": true,
      "multiFrame": false,
      "defaultTags": ["assetType:overlay"]
    }
  ]
}
